{
  "module_id": "M0009",
  "title": "NLP Lab",
  "duration": "75 minutes",
  "level": "Advanced",
  "description": "Apply Neuro-Linguistic Programming (NLP) principles to enhance leadership skills",
  "objectives": [
    "Rapport-building",
    "Reframing",
    "Anchoring"
  ],
  "outcomes": [
    "Improve communication",
    "Enhance influence",
    "Develop decision-making skills"
  ],
  "techniques": [
    {
      "name": "Rapport-building",
      "description": "Mirror and match verbal/non-verbal cues to establish trust"
    },
    {
      "name": "Reframing",
      "description": "Transform negative thoughts into positive, empowering ones"
    },
    {
      "name": "Anchoring",
      "description": "Associate emotions with specific triggers to manage responses"
    }
  ],
  "generated_text": "**Module 9: NLP Lab (75 minutes, Advanced)**\n\nApply Neuro-Linguistic Programming (NLP) principles to enhance leadership skills. In this lab, you'll practice:\n\n1. **Rapport-building**: Mirror and match verbal/non-verbal cues to establish trust.\n2. **Reframing**: Transform negative thoughts into positive, empowering ones.\n3. **Anchoring**: Associate emotions with specific triggers to manage responses.\n\nThrough interactive exercises and group discussions, you'll develop NLP techniques to improve communication, influence, and decision-making. By the end of this lab, you'll be able to apply NLP principles to real-world leadership challenges."
}