{
  "module_id": "M0015",
  "duration": 34,
  "level": "Advanced",
  "description": "Natural Language Processing (NLP) is a subset of AI that enables machines to understand and generate human language.",
  "key_concepts": [
    "tokenization",
    "sentiment analysis",
    "named entity recognition"
  ],
  "deep_learning_techniques": [
    "recurrent neural networks (RNNs)",
    "transformers"
  ],
  "practical_applications": [
    "text classification",
    "language translation",
    "chatbots"
  ],
  "learning_outcome": "design and implement effective NLP solutions",
  "generated_text": "**Module 15: NLP**\n**Duration: 34 minutes**\n**Level: Advanced**\n\nNatural Language Processing (NLP) is a subset of AI that enables machines to understand and generate human language. Key concepts include tokenization, sentiment analysis, and named entity recognition. Advanced learners will explore deep learning techniques, such as recurrent neural networks (RNNs) and transformers, to improve NLP models. Practical applications include text classification, language translation, and chatbots. By completing this module, you will be able to design and implement effective NLP solutions, leveraging AI to extract insights from unstructured data and drive business value."
}