{
  "module_id": "M0040",
  "duration": 89,
  "level": "Advanced",
  "topics": [
    "Data structures",
    "Object-Oriented Programming",
    "File input/output and exception handling",
    "Advanced modules"
  ],
  "subtopics": {
    "Data structures": [
      "lists",
      "dictionaries",
      "sets"
    ],
    "Object-Oriented Programming": [
      "classes",
      "inheritance"
    ],
    "Advanced modules": [
      "NumPy",
      "Pandas",
      "Matplotlib"
    ]
  },
  "assessment": {
    "multiple_choice_questions": 20,
    "coding_challenges": 5
  },
  "generated_text": "**Module 40: Python**\n**Duration: 89 minutes**\n**Level: Advanced**\n\nTest your Python skills with this advanced quiz. Evaluate your knowledge of:\n\n1. Data structures: lists, dictionaries, and sets\n2. Object-Oriented Programming: classes and inheritance\n3. File input/output and exception handling\n4. Advanced modules: NumPy, Pandas, and Matplotlib\n\nComplete 20 multiple-choice questions and 5 coding challenges to assess your proficiency. Upon completion, review answers and explanations to reinforce learning. This quiz is designed to challenge advanced learners and provide practical experience with Python programming concepts."
}